{
  "artifact_type": "shadow_pilot_output_manifest",
  "artifacts": [
    {
      "bytes": 1648,
      "path": "baseline_comparison.json",
      "sha256": "a356cf5697751e4fe2dec46d4d5a1135741ded304e5bf8fb7fdfdcf7fd644394"
    },
    {
      "bytes": 683,
      "path": "invariant_report.json",
      "sha256": "6e9146be984b77bd2e2c6339f1b6ab1c7d9a0af8f39370be15f3b08b4dca5d78"
    },
    {
      "bytes": 137,
      "path": "logs/executor.log",
      "sha256": "07ccfb33dc0d7d4da4078efee9c3316238db2b4f6105a90915641e82b283b8c1"
    },
    {
      "bytes": 160,
      "path": "logs/shadow_pilot.log",
      "sha256": "f2ba3cc9fcdccc061505734d7e8f1c63226f910ec19775f08680534ad856047b"
    },
    {
      "bytes": 2512,
      "path": "reproducibility_report.json",
      "sha256": "754da8d3a96fe249a42b4dece62f9894144a843f488647ac13a57e96f9f0411a"
    },
    {
      "bytes": 1321,
      "path": "shadow_job_envelope.json",
      "sha256": "8127c0ca875690609b77a66bbc7b9afdf9b0e4d2822383730ad819ea5f036778"
    }
  ],
  "logs_required": [
    "logs/shadow_pilot.log",
    "logs/executor.log"
  ],
  "schema_version": 1,
  "shadow_id": "open_macro_v03_shadow_001",
  "shadow_pilot_id": "open_macro_v03_shadow_pilot_001",
  "status": "succeeded",
  "unexpected_outputs": []
}
